{
  "id": "262",
  "title": "SH-259 — XBZ selective import + add to quote",
  "issue": 262,
  "pr": 310,
  "status": "done",
  "agent": null,
  "objective": "Preserve the completed SH-259 implementation as durable memory after PR #310 merged; no implementation work remains on this front.",
  "definition_of_done": [
    "Explicit confirmation is the first write boundary",
    "Real quote quantity drives XBZ revalidation",
    "Product import/reconciliation reuses Part A",
    "quote_item stores historical snapshot",
    "No automatic sale/order/publication/send",
    "Independent QA approved the exact PR head before human merge",
    "PR #310 merged into main"
  ],
  "depends_on": [],
  "canonical_refs": [
    "ADR:XBZ_ON_DEMAND",
    "ADR:XBZ_PRODUCT_FIRST_FOR_QUOTES",
    "ADR:QUOTE_ITEM_IS_HISTORICAL_SNAPSHOT"
  ],
  "procedure_refs": ["PROCEDURE:INDEPENDENT_PR_QA"],
  "gotcha_refs": ["GOTCHA:XBZ_ADJUSTED_QUANTITY_IS_NOT_STOCK"],
  "latest_handoff": "PR #310 merged on 2026-08-19 at e770f35747f02861c28ac2e98aa59ca02a7501dd into main as 00a97ddaa7f8c869ff1929f6c963906f3d5b845e after independent QA and explicit human merge. Issue #262 remains open by governance; no close authority is implied.",
  "reservations": {
    "owned": [],
    "forbidden": []
  },
  "authority": {
    "inspect": true,
    "branch_write": false,
    "push_branch": false,
    "open_draft_pr": false,
    "merge": false,
    "close_issue": false,
    "deploy_production": false,
    "remote_db": false,
    "destructive_remote_data": false,
    "write_scope": {
      "local": false,
      "paths": [],
      "commit": false,
      "push": false
    },
    "collaboration": {
      "open_draft_pr": false,
      "update_draft_pr": false,
      "comment_evidence": false
    }
  },
  "live_state": {
    "base_sha": "8599aa3c186ecb58f4a7eecdad8aa8a6ba9e4e9d",
    "head_sha": "e770f35747f02861c28ac2e98aa59ca02a7501dd",
    "verified_at": "2026-08-19T07:29:00-03:00",
    "requires_recheck": true,
    "source": "GitHub PR #310 + issue #262 + main branch",
    "truth_class": "LIVE_VERIFIED"
  },
  "control_plane_state": {
    "truth_class": "CONTROL_PLANE_CANONICAL",
    "verified_at": "2026-08-19T07:29:00-03:00",
    "contradiction_detected": false
  },
  "blockers": [
    "Issue #262 remains open and requires explicit human close authorization; final XBZ end-to-end QA #248 is still planned after #308"
  ],
  "next_action": "Do not edit SH-259 implementation. After #308 is merged, run #248 as the final XBZ vertical QA; close #262 only under explicit human authorization.",
  "updated_at": "2026-08-19T07:29:00-03:00"
}
